{"info":[{"startDate":"01/04/2022","endDate":"30/04/2022","category":"cadre","coefficient":"130","siret":"52255241300026","securiteSoc":"192040602921480","job":" full stack developer monsieur anthony portier","brut":"3500.00","net":"2637.61","netBeforeTaxes":"2691.93","mandatorySentence":true},{"startDate":"01/04/2022","endDate":"30/04/2022","category":"cadre","coefficient":"130","siret":"52255241300026","securiteSoc":"192040602921480","job":" full stack developer monsieur anthony portier","brut":"3500.00","net":"2637.61","netBeforeTaxes":"2691.93","mandatorySentence":true},{"brut":"NaN","netBeforeTaxes":"NaN","mandatorySentence":false},{"brut":"","netBeforeTaxes":"","mandatorySentence":false},{"startDate":"01/04/2022","endDate":"30/04/2022","category":"cadre","coefficient":"130","siret":"52255241300026","securiteSoc":"192040602921480","job":"","brut":"3500.00","net":"2637.61","netBeforeTaxes":"NaN","mandatorySentence":true}],"data":["KUMULLUS BULLETIN DE PAIE\n\nPériode de paie : du 01/04/2022 au 30/04/2022\n104 avenue Albert 1er Paiement par virement le 30/04/2022\n92500 RUEIL MALMAISON\n\nConvention Collective Bureaux d'études techniques\n\nSIRET : 52255241300026 APE : 6201Z\nMatricule 08556\nN° sécurité soc 192040602921480\nEmploi Full Stack Developer Monsieur Anthony PORTIER\nCatégorie Cadre 134 Avenue Pierre Brossolette\nPosition 2-2 94170 Le-Perreux-sur-Marne\nCoefficient 130\nAncienneté 24/02/2020\nEntrée le 24/02/2020\n\n   \n  \n\n \n\nRS Taux Résultat (ERS RU S BECUTETS\nSalariale Salarial Patronale Patronal\n\nSalaire de base 151.67 23.0764 3500.00\n\nCongés payés 2 jours du 14/04/2022 au 15/04/2022 2.00 161.5136 -323.03\n\nMaintien absences CP 323.03\n\nSalaire Brut 3500.00\n\nSsanté\n\nSécurité sociale-maladie, maternité, invalidité-décès 3500.00 3500.00 7.0000 245.00\nComplémentaire incapacité-invalidité-décès 59.65\nComplémentaire santé 37.37 37.37\nAccidents du travail - maladies professionnelles 3500.00 3500.00 0.7700 26.95\nRetraite\n\nSécurité sociale plafonnée 3428.00 6.9000 236.53 3428.00 8.5500 293.09\nSécurité sociale déplafonnée 3500.00 0.4000 14.00 3500.00 1.9000 66.50\nComplémentaire retraite tranche 1 3428.00 4.0100 137.46 3428.00 6.0100 206.02\nComplémentaire retraite tranche 2 72.00 9.7200 7.00 72.00 14.5700 10.49\nCET 3500.00 0.1400 4.90 3500.00 0.2100 7.35\nAllocations familiales 120.75\nAutres contributions dues par l'employeur 60.52\nAssurance chômage\n\nChômage 3500.00 3500.00 4.2000 147.00\nApec 3500.00 0.0240 0.84 3500.00 0.0360 1.26\nCSG non imposable à l'impôt sur le revenu 3535.77 6.8000 240.43\n\nCSG/RDS imposable à l'impôt sur le revenu 3535.77 2.9000 102.54\n\nTitre restaurant 18.00 1.5000 27.00 18.00 1.5000 27.00\nTotal des retenues: 808.07 1308.95\nNet à payer avant impôt sur le revenu 2691.93\n\nImpôt sur le revenu prélevé à la source 2858.84 -1.9000 -54.32\n\nNet Imposable: 2858.84\n\nNet à Payer: 2637.61\n\nJournée de solidarité 24/05\n\n \n\n \n\n \n\n \n\n \n\n \n\n \n\nEn PEIReS DE ETE RE ES ETE e Heures\n\nMois 3500.00 3428.00 2858.84 1308.95 808.07 4808.95 54.32 151.67\n\nAnnée 14000.00 13712.00 11435.36 5247.80 3244.28 20247.80 217.28 606.68\nLo TR S\n\nAcquis 25.00 22.71\n\nPris 25.00 10.00 Net payé : 2637.61 euros\n\nSolde 12.71\n\n \n\nDans votre intérêt, et pour vous aider à faire valoir vos droits, conservez ce bulletin de paie sans limitation de durée. Informations complémentaires: www.service-public.fr\n1\n\f","KUMULLUS BULLETIN DE PAIE\nPériode de paie : du 01/04/2022 au 30/04/2022\n104 avenue Albert 1er Paiement par virement le 30/04/2022\n92500 RUEIL MALMAISON\nConvention Collective Bureaux d'études techniques\nSIRET : 52255241300026 APE : 6201Z\nMatricule 08556\nN° sécurité soc 192040602921480\nEmploi Full Stack Developer Monsieur Anthony PORTIER\nCatégorie Cadre 134 Avenue Pierre Brossolette\nPosition 2-2 94170 Le-Perreux-sur-Marne\nCoefficient 130\nAncienneté 24/02/2020\nEntrée le 24/02/2020\nLibellé Base Taux PE ETe Base RU S BECUTETS\nSalariale Salarial LS Patronal\nSalaire de base 151.67 23.0764 3500.00\nCongés payés 2 jours du 14/04/2022 au 15/04/2022 2.00 161.5136 -323.03\nMaintien absences CP 323.03\nSalaire Brut 3500.00\nSsanté\nSécurité sociale-maladie, maternité, invalidité-décès 3500.00 3500.00 7.0000 245.00\nComplémentaire incapacité-invalidité-décès 59.65\nComplémentaire santé 37.37 37.37\nAccidents du travail - maladies professionnelles 3500.00 3500.00 0.7700 26.95\nRetraite\nSécurité sociale plafonnée 3428.00 6.9000 236.53 3428.00 8.5500 293.09\nSécurité sociale déplafonnée 3500.00 0.4000 14.00 3500.00 1.9000 66.50\nComplémentaire retraite tranche 1 3428.00 4.0100 137.46 3428.00 6.0100 206.02\nComplémentaire retraite tranche 2 72.00 9.7200 7.00 72.00 14.5700 10.49\nCET 3500.00 0.1400 4.90 3500.00 0.2100 7.35\nAllocations familiales 120.75\nAutres contributions dues par l'employeur 60.52\nAssurance chômage\nChômage 3500.00 3500.00 4.2000 147.00\nApec 3500.00 0.0240 0.84 3500.00 0.0360 1.26\nCSG non imposable à l'impôt sur le revenu 3535.77 6.8000 240.43\nCSG/RDS imposable à l'impôt sur le revenu 3535.77 2.9000 102.54\nTitre restaurant 18.00 1.5000 27.00 18.00 1.5000 27.00\nTotal des retenues: 808.07 1308.95\nNet à payer avant impôt sur le revenu 2691.93\nImpôt sur le revenu prélevé à la source 2858.84 -1.9000 -54.32\nNet Imposable: 2858.84\nNet à Payer: 2637.61\nJournée de solidarité 24/05\nBrut P PI ESS DE TS PS PEN Coût global p Heures\nes e ms e es en es Qm m\nse m e um uux 0s uu us\nLR E (UE\nGs [um Qmn | | 0\nm (me — je@e — | |J | Net payé ; 2637.61 euros\n#\nDans votre intérêt, et pour vous aider à faire valoir vos droits, conservez ce bulletin de paie sans limitation de durée. Informations complémentaires: www.service-public.fr\n1\n\f","îervezliî%%fr\n\f","\f","KUMULLUS\n\nBULLETIN DE PAIE\n\nPériode de paie : du 01/04/2022 au 30/04/2022\n\n104 avenue Albert 1er\n\nPaiement par virement le 30/04/2022\n\n92500 RUEIL MALMAISON\n\nConvention Collective Bureaux d'études techniques\n\nSIRET : 52255241300026\n\nAPE : 6201Z\n\nMatricule\n\n08556\n\nN° sécurité soc\n\n192040602921480\n\nEmploi\n\nFull Stack Developer\n\nMonsieur Anthony PORTIER\n\nCatégorie\n\nCadre\n\n134 Avenue Pierre Brossolette\n\nPosition\n\n2-2\n\n94170 Le-Perreux-sur-Marne\n\nCoefficient\n\n130\n\nAncienneté\n\n24/02/2020\n\nEntrée le\n\n24/02/2020\n\n1S\n\nCENS\n\nTaux\n\nPE ETe\n\nBase\n\nTaux\n\nBECUTETS\n\nSalariale\n\nSalarial\n\nPatronale\n\nPatronal\n\nSalaire de base\n\n151.67\n\n23.0764\n\n3500.00\n\nCongés payés 2 jours du 14/04/2022 au 15/04/2022\n\n2.00\n\n161.5136\n\n-323.03\n\nMaintien absences CP\n\n323.03\n\nSalaire Brut\n\n3500.00\n\nSsanté\n\nSécurité sociale-maladie, maternité, invalidité-décès\n\n3500.00\n\n3500.00\n\n7.0000\n\n245.00\n\nComplémentaire incapacité-invalidité-décès\n\n59.65\n\nComplémentaire santé\n\n37.37\n\n37.37\n\nAccidents du travail - maladies professionnelles\n\n3500.00\n\n3500.00\n\n0.7700\n\n26.95\n\nRetraite\n\n3428.00\n\n6.9000\n\n236.53\n\n3428.00\n\n8.5500\n\n293.09\n\nSécurité sociale plafonnée\n\nSécurité sociale déplafonnée\n\n3500.00\n\n0.4000\n\n14.00\n\n3500.00\n\n1.9000\n\n66.50\n\nComplémentaire retraite tranche 1\n\n3428.00\n\n4.0100\n\n137.46\n\n3428.00\n\n6.0100\n\n206.02\n\n72.00\n\n9.7200\n\n7.00\n\n72.00\n\n14.5700\n\n10.49\n\nComplémentaire retraite tranche 2\n\nCET\n\n3500.00\n\n0.1400\n\n4.90\n\n3500.00\n\n0.2100\n\n7.35\n\nAllocations familiales\n\n120.75\n\nAutres contributions dues par l'employeur\n\n60.52\n\nAssurance chômage\n\n3500.00\n\n3500.00\n\n4.2000\n\n147.00\n\nChômage\n\nApec\n\n3500.00\n\n0.0240\n\n0.84\n\n3500.00\n\n0.0360\n\n1.26\n\nCSG non imposable à l'impôt sur le revenu\n\n3535.77\n\n6.8000\n\n240.43\n\nCSG/RDS imposable à l'impôt sur le revenu\n\n3535.77\n\n2.9000\n\n102.54\n\nTitre restaurant\n\n18.00\n\n1.5000\n\n27.00\n\n18.00\n\n1,5000\n\n27.00\n\nTotal des retenues:\n\n808.07\n\n1308.95\n\n2691.93\n\nNet à payer avant impôt sur le revenu\n\nImpôt sur le revenu prélevé à la source\n\n2858.84\n\n-1.9000\n\n-54.32\n\nNet Imposable:\n\n2858.84\n\nNet à Payer:\n\n2637.61\n\nJournée de solidarité 24/05\n\nBrut\n\nPE\n\nRet salariales\n\nL\n\nHeures\n\nNet imposable\n\nPEN S\n\n(e1i 11157\n\nMois\n\n3500.00\n\n3428.00\n\n2858.84\n\n1308.95\n\n808.07\n\n4808.95\n\n54.32\n\n151.67\n\nAnnée\n\n14000.00\n\n13712.00\n\n11435.36\n\n5247.80\n\n3244.28\n\n20247.80\n\n217.28\n\n606.68\n\nLS\n\nE\n\nLo TR S\n\n25.00\n\n22.71\n\nAcquis\n\nPris\n\n25.00\n\n10.00\n\nNet payé : 2637.61 euros\n\nSolde\n\n12.71\n\nDans votre intérêt, et pour vous aider à faire valoir vos droits, conservez ce bulletin de paie sans limitation de durée. Informations complémentaires: www.service-public.fr\n\n1\n\f"]}